[
  {
    "id": "alt-hn",
    "name": "alt.hn",
    "tagline": "Alternative Hacker News web client",
    "description": "Alternative Hacker News web client with a clean, fast reading experience.",
    "platforms": ["web"],
    "client_type": "web",
    "price": "free",
    "open_source": false,
    "homepage_url": "https://alt-hn.vercel.app/",
    "tags": ["minimal", "fast"],
    "status": "active",
    "last_checked": "2025-12-25"
  },
  {
    "id": "brutalist-hacker-news",
    "name": "Brutalist Hacker News",
    "tagline": "Brutalist-inspired HN reader",
    "description": "Brutalist-inspired Hacker News reader focused on a bold, high-contrast layout.",
    "platforms": ["web"],
    "client_type": "web",
    "price": "free",
    "open_source": false,
    "homepage_url": "https://brutalisthackernews.com/",
    "hn_discussion_url": "https://news.ycombinator.com/item?id=39955057",
    "tags": ["minimal", "reader"],
    "status": "active",
    "last_checked": "2025-12-25"
  },
  {
    "id": "hn-reader-pwa",
    "name": "Hacker News Reader PWA",
    "tagline": "PWA web client for HN",
    "description": "Progressive web app for browsing Hacker News with a native-app feel in the browser.",
    "platforms": ["web"],
    "client_type": "web",
    "price": "free",
    "open_source": false,
    "homepage_url": "https://app.hn-reader.com/",
    "tags": ["reader", "fast", "minimal"],
    "status": "active",
    "last_checked": "2025-12-25"
  },
  {
    "id": "hackernews-summary",
    "name": "Hacker News Summary",
    "tagline": "Summarized HN front page",
    "description": "Web client that summarizes Hacker News stories and highlights key discussions.",
    "platforms": ["web"],
    "client_type": "web",
    "price": "free",
    "open_source": false,
    "homepage_url": "https://hackernews.betacat.io/",
    "tags": ["reader", "minimal"],
    "status": "active",
    "last_checked": "2025-12-25"
  },
  {
    "id": "hn-buzzing",
    "name": "Hacker News in Chinese",
    "tagline": "Chinese HN reader",
    "description": "Chinese-language Hacker News reader with translated headlines and discussions.",
    "platforms": ["web"],
    "client_type": "web",
    "price": "free",
    "open_source": false,
    "homepage_url": "https://hn.buzzing.cc/",
    "tags": ["reader"],
    "status": "active",
    "last_checked": "2025-12-25"
  },
  {
    "id": "full-hn",
    "name": "Full Hacker News",
    "tagline": "Full comments on one page",
    "description": "HN web client that shows stories and comments together on a single page.",
    "platforms": ["web"],
    "client_type": "web",
    "price": "free",
    "open_source": false,
    "homepage_url": "http://www.fullhn.com/",
    "tags": ["reader", "comments-first"],
    "status": "active",
    "last_checked": "2025-12-25"
  },
  {
    "id": "hacki",
    "name": "Hacki for Hacker News",
    "description": "Open-source iOS Hacker News client with a clean interface and offline reading.",
    "platforms": ["ios"],
    "client_type": "mobile",
    "price": "free",
    "open_source": true,
    "repo_url": "https://github.com/Livinglist/Hacki",
    "homepage_url": "https://github.com/Livinglist/Hacki",
    "tags": ["offline", "reader"],
    "status": "active",
    "last_checked": "2025-12-25"
  },
  {
    "id": "ihnews",
    "name": "iHNews",
    "description": "Open-source iOS Hacker News client for reading stories and comments on the go.",
    "platforms": ["ios"],
    "client_type": "mobile",
    "price": "free",
    "open_source": true,
    "repo_url": "https://github.com/guidefreitas/iHNews",
    "homepage_url": "https://github.com/guidefreitas/iHNews",
    "tags": ["reader"],
    "status": "active",
    "last_checked": "2025-12-25"
  },
  {
    "id": "hews",
    "name": "Hews",
    "description": "Open-source Android Hacker News client focused on speed and simplicity.",
    "platforms": ["android"],
    "client_type": "mobile",
    "price": "free",
    "open_source": true,
    "repo_url": "https://github.com/leavjenn/Hews",
    "homepage_url": "https://leavjenn.github.io/Hews/",
    "tags": ["fast", "minimal"],
    "status": "active",
    "last_checked": "2025-12-25"
  },
  {
    "id": "materialistic",
    "name": "Materialistic",
    "description": "Open-source Android Hacker News client with Material Design and offline support.",
    "platforms": ["android"],
    "client_type": "mobile",
    "price": "free",
    "open_source": true,
    "repo_url": "https://github.com/hidroh/materialistic",
    "homepage_url": "https://github.com/hidroh/materialistic",
    "tags": ["offline", "reader", "themeable"],
    "status": "active",
    "last_checked": "2025-12-25"
  },
  {
    "id": "hnclient",
    "name": "HNClient",
    "description": "Cross-platform desktop Hacker News client for Windows, macOS, and Linux.",
    "platforms": ["windows", "macos", "linux"],
    "client_type": "desktop",
    "price": "free",
    "open_source": true,
    "repo_url": "https://github.com/florian/hnclient",
    "homepage_url": "https://florian.github.io/HNClient/",
    "tags": ["reader"],
    "status": "active",
    "last_checked": "2025-12-25"
  },
  {
    "id": "haxor-news",
    "name": "Haxor-News",
    "description": "Terminal-based Hacker News client for keyboard-centric reading.",
    "platforms": ["terminal"],
    "client_type": "terminal",
    "price": "free",
    "open_source": true,
    "repo_url": "https://github.com/donnemartin/haxor-news",
    "homepage_url": "https://github.com/donnemartin/haxor-news",
    "tags": ["keyboard", "minimal"],
    "status": "active",
    "last_checked": "2025-12-25"
  }
]
